{
  "request_id": "req_low_conf",
  "trace_id": "trace_low_conf",
  "q_norm": "harry potter",
  "q_nospace": "harrypotter",
  "canonical_key": "ck:0f1e2d3c4b5a",
  "locale": "en-US",
  "detected": {
    "mode": "normal",
    "is_isbn": false,
    "has_volume": false,
    "lang": "en"
  },
  "reason": "LOW_CONFIDENCE",
  "signals": {
    "top_score": 0.12,
    "score_gap": 0.01,
    "token_count": 2,
    "latency_budget_ms": 800
  }
}
